NAME,PRODUCT,PRICE,RATING,SELLER
Meia Blue Art Silk With Blouse Saree,Sarees,399Rs,,FANCYWEAR
Bhuwal Fashion Green Embroidered Polycotton Saree With Blouse,Sarees,449Rs,3.4,Bhuwal Fashion
Women's Yellow Color Cotton Silk Plain Saree Border Tassels With Blouse Piece(Jugni-YellowFree Size),Sarees,399Rs,5,INDIAN BEAUTY.
White World Women's Velvet and net black color saree with Blouse piece,Sarees,469Rs,2,White world creation
Meia Red Bhagalpuri Cotton Silk Printed Saree With Blouse,Sarees,449Rs,3.1,NEW MARUTI ENTERPRISE
Meia Multicolor Georgette Printed Saree With  (Combo),Sarees,599Rs,4.1, ANAND SAREES
Indian Style Sarees New Arrivals Women's Green Georgette Printed Party Saree With Blouse Bollywood Latest Designer Saree,Sarees,549Rs,2,RAJESHWAR FASHION
satin patta saree with blouse piece,Sarees,749Rs,4,NEW MARUTI ENTERPRISE
Indian Beauty Women's Khadi Silk Elephant Kalamkari Printed Saree (WhiteFreeSize),Sarees,399Rs,4.3,INDIAN BEAUTY.
Fab Woven Kanjivaram Tussar Silk Saree,Sarees,749Rs,3.7, FAB WOVEN
Fab Woven Kanjivaram Raw Silk Saree,Sarees,749Rs,4, FAB WOVEN
V-KARAN Women's Pink Art Silk  Printed Party Wear Saree With Blouse,Sarees,299Rs,,V-Karan
Anand Sarees Floral Fashion Faux Georgette Saree,Sarees,299Rs,3.7, ANAND SAREES
Styloce Multicolor Georgette Printed Saree With Blouse,Sarees,399Rs,3.8,Pari Designerr
Chanderi Saree With Blouse - 5.25 Meter,Sarees,399Rs,3.7,Bhuwal Fashion
New Designer Red Chiffon Saree,Sarees,599Rs,3.6,STYLZONE
Fab Woven Kanjivaram Tussar Silk Saree,Sarees,749Rs,3.4, FAB WOVEN
Florence Green Cotton Silk Plain Saree With Blouse,Sarees,449Rs,3,florence clothing company
Indian Fashionista Red Banarasi Silk Plain Saree With Blouse,Sarees,369Rs,,Indian Fashionista
Anand Sarees Floral Fashion Faux Georgette Saree,Sarees,289Rs,4.4, ANAND SAREES
MMW Women's Marron Embroidered Saree with Blouse Piece(Free Size),Sarees,499Rs,,Market  Magic World
Meia Multicolor Georgette Printed Saree With  (Combo),Sarees,599Rs,3.7, ANAND SAREES
Meia Blue Georgette Embroidered Saree With Blouse,Sarees,1149Rs,3.8,CRAZYDDEAL
Aika Women's Silk Checkered Saree (Sana Chokda Red),Sarees,299Rs,,Aika Fashion
Fabwomen Yellow Art Silk Printed Saree With Blouse,Sarees,399Rs,5,Fabwomen
Anand Sarees Printed Fashion Faux Georgette Saree,Sarees,289Rs,4.7, ANAND SAREES
Indian Beauty Women's Black Color Kalamkari Mysore Silk Printed Saree Border Tassels With Blouse Piece(NIRVAA HATHI-BLACKFree Size),Sarees,419Rs,4,INDIAN BEAUTY.
Meia Womens Green and Multi Colored Printed Casual Wear Poly Silk Saree with Unstitched Blouse,Sarees,299Rs,4.5,Swaron
Indian Beauty Women's Pink Color Kashmiri Silk With Tessal Printed Saree With Blouse Piece,Sarees,429Rs,,INDIAN BEAUTY.
Indian Style Sarees New Arrivals Latest Women's Yellow Georgette Printed Saree Bollywood Designer Saree With Blouse,Sarees,549Rs,4,RAJESHWAR FASHION
Pemal Designer Womans Havy Fabric Plain Chanderi  Cotton Saree With Banglori Print Blouse Pic  BBC125L,Sarees,419Rs,, Mahadev Enterprises
Indian Beauty Women's Blue Color Mysore Silk Printed Saree Border Tassels With Blouse Piece(JANNAT-BLUE),Sarees,399Rs,2,INDIAN BEAUTY.
Mastani yellow Colour Plain Georgette Border Work Saree KD-017-e,Sarees,430Rs,5,G JELLY FASHION TREE
Anand Sarees Floral Fashion Faux Georgette Saree,Sarees,289Rs,, ANAND SAREES
Indian Beauty Women's Bollywood Designer Cotton Silk Saree,Sarees,449Rs,4,INDIAN BEAUTY.
Indian Beauty Women's Khadi Silk Elephant Kalamkari Printed Sarees,Sarees,399Rs,4,INDIAN BEAUTY.
Meia Women's Silk Checkered Saree (Sana Chokda Blue),Sarees,299Rs,,Great Rate
FAB BRAND BANARASI Silk Saree With Blouse Piece,Sarees,999Rs,4,FAB BRAND
Aika Women's Cotton Silk Woven Saree (AURA SAREE PISTA),Sarees,299Rs,,Aika Fashion
Women's Black Color Mysore Art Silk Printed Saree With Blouse Piece,Sarees,399Rs,,INDIAN BEAUTY.
Women's White Color Georgette Printed Saree With Blouse Piece(Designer-Vivera-WhiteFree Size),Sarees,379Rs,5,INDIAN BEAUTY.
Indian Beauty Green Silk Printed Saree With Blouse,Sarees,399Rs,,INDIAN BEAUTY.
Meia Brown Georgette Printed Saree With Blouse,Sarees,919Rs,4.4,Swaron
Anand Sarees Printed Fashion Faux Georgette Saree,Sarees,289Rs,3.6, ANAND SAREES
Anjaneya Sarees Women's Tan Georgette  Ruffle Saree With Blouse,Sarees,999Rs,,CnH Emporio
Indian Beauty Women's Brown Cotton Plain Saree With Blouse Piece (BrownFree Size),Sarees,299Rs,3.5,INDIAN BEAUTY.
Fab Brand Multicolor Kanjivaram Raw Silk Saree,Sarees,699Rs,3,FAB BRAND
Indian Style Sarees New Arrivals Latest Women's Ethnic Wear Kanjivaram Cotton Silk Saree With Blouse Bollywood Designer,Sarees,379Rs,3.5,RAJESHWAR FASHION
Yuvanika Multicolor Printed Bhagalpuri Silk Saree with Blouse-SVIP13348,Sarees,299Rs,4,Yuvanika sare
Meia Pink Art Silk With Blouse Saree,Sarees,389Rs,,FANCYWEAR
Svb Saree Red Colour Bhagalpuri Silk SAree Without Blouse,Sarees,239Rs,3,SVB SAREES
Bollywood Style Embroidered Zarana Silk Saree with Contrast Blouse,Sarees,399Rs,4.1,Bhuwal Fashion
