NAME,PRODUCT,PRICE,RATING,SELLER
Svb Sarees Cotton Block Print Saree Without Blouse,Sarees,189Rs,3.1,SVB SAREES
TexStile sarees womens Party wear Designer Sarees with Blouse Pieces(Sargam Cyan sari),Sarees,589Rs,3.3,Texstile Arena
Yellow Art Silk Block Print Saree with Blouse Piece,Sarees,379Rs,3,SHARDA  CREATION
Indian Beauty Red Art Silk Printed Saree With Blouse,Sarees,369Rs,3.5,INDIAN BEAUTY.
SVB Multicolor Cotton Block Print Saree Without Blouse,Sarees,199Rs,3.3,SVB SAREES
SVB SAREE Royal Blue Colour Khadi silk saree with Blouse Piece,Sarees,429Rs,2.8,SVB SAREES
Embroidered Polycotton Saree With Blouse,Sarees,339Rs,3.7,Bhuwal Fashion
CRAZYDDEAL Black  Cream Georgette Embroidered Saree With Blouse,Sarees,699Rs,2.7,Bhavna creation
Ruchika Fashion Green Plain Cotton Silk Saree With Blouse & Free Mangalsutra,Sarees,349Rs,3.5,Ruchika Fashions
Pari Designerr Green Self Design Chiffon Saree With Blouse,Sarees,379Rs,3.7,Pari Designerr
Fabwomen Blue Bhagalpuri Silk Printed Saree With Blouse,Sarees,349Rs,3.4,Fabwomen
Pemal Designer Women's Cotton Silk Weaving Saree With Jecqured Border Running Blouse Pics BBC90,Sarees,649Rs,3.6, Mahadev Enterprises
Bhuwal Fashion Women's Plain Polycotton Casual Saree with Blouse (Colors Available),Sarees,279Rs,3.5,Bhuwal Fashion
Meia Red Embroidered Georgette Saree For Women,Sarees,849Rs,2.6,NEW MARUTI ENTERPRISE
B.bella creation Georgette Saree,Sarees,499Rs,3.3,B BELLA CREATION
White World Creation Blue Velvet and Net Embroidered Saree With Blouse,Sarees,449Rs,3.8,White world creation
Indian Beauty Mustard  Yellow Art Silk Blended Mysore Printed Saree With Blouse,Sarees,399Rs,3.5,INDIAN BEAUTY.
Ruchika Fashion Striped LinenHandloom Cotton Linen Blend Saree  (Off-White),Sarees,199Rs,3.1,Ruchika Fashions
Svb Sarees Presented Art silk Saree Without blouse piece,Sarees,199Rs,3.1,SVB SAREES
Meia Women's Cotton Silk Woven Saree (AURA SAREE PEACH),Sarees,299Rs,,Great Rate
SVB SAREES Blue  Art Silk  Block Print Saree Without Blouse,Sarees,199Rs,3.7,SVB SAREES
Ruchika Fashion Women's Checkered Handloom Cotton Linen Blend Saree with Blouse Piece (Chokdi),Sarees,199Rs,2.3,Ruchika Fashions
Bhuwal Fashion Blue  Cream Zarana Silk Embroidered Saree With Blouse,Sarees,379Rs,3.8,Bhuwal Fashion
Ruchika Fashion Beige & Red Georgette Embroidered Saree With Blouse,Sarees,799Rs,3.8,Ruchika Fashions
Indian Beauty Multicolor Khadi Printed Saree With Blouse,Sarees,399Rs,3.4,INDIAN BEAUTY.
Yuvanika white colour Bhagalpuri Silk floral Saree With Blouse,Sarees,299Rs,3.9,Yuvanika sare
Pemal Designer Women's Kanjivaram Silk Saree With Jecqured Border Running Blouse Pics HVM114,Sarees,729Rs,3.7, Mahadev Enterprises
Bhuwal Fashion Multicolor Cotton Silk Embroidered Saree With Blouse ( Colours Available),Sarees,349Rs,3.6,Bhuwal Fashion
satin patta sarees,Sarees,649Rs,4.5,NEW MARUTI ENTERPRISE
Meia Red Georgette Embroidered Saree With Blouse,Sarees,579Rs,2.6,Bhavna creation
SVB Sarees Pink Taffeta Silk Printed Saree Without Blouse Piece,Sarees,199Rs,3,SVB SAREES
Anand Sarees Multicolor Georgette Printed Saree With Blouse,Sarees,289Rs,3.6, ANAND SAREES
SVB Saree Multicolour Khadi silk saree,Sarees,399Rs,2.3,SVB SAREES
Bhuwal Fashion Blue Faux Georgette Embroidered Saree,Sarees,499Rs,3.9,Bhuwal Fashion
Bhavna Creation's Purple Silk Saree,Sarees,1139Rs,5,Bhavna creation
Meia Pink Polyester Printed Saree With Blouse,Sarees,249Rs,,Swaron
Meia Yellow Polyester Printed Saree With Blouse,Sarees,289Rs,2.5,Swaron
Women's Yellow Color Cotton Silk Blend Printed Saree Border Tassels With Blouse Piece(DEEPA-YELLOWFree Size),Sarees,399Rs,3.6,INDIAN BEAUTY.
Pemal Designer Womens Cotton Silk Saree With Blouse Pic BBC129C,Sarees,949Rs,5, Mahadev Enterprises
Meia Women's Cotton Silk Woven Combo of 2 Saree (Aura Saree 2 Red-Peach),Sarees,499Rs,,Great Rate
Tiana Creation Pink Embroidered Net Saree With Blouse,Sarees,1649Rs,3.9,Tiana Creation
Mastani Sarees New Arrivals Latest Women's Multi Color Chanderi Cotton Printed Border Work Bollywood Designer Saree,Sarees,399Rs,,NEW MARUTI ENTERPRISE
Swaron Off White Georgette Printed Saree With Unstitched Blouse,Sarees,329Rs,4.1,Swaron
Meia Womens Beige and Green Poly Silk Woven Patta Festive Wear Saree,Sarees,419Rs,3.3,Swaron
Bollywood Designer Oranhe Georgette Saree,Sarees,679Rs,4, Meera Saree
Anand Sarees Multicolor Faux Georgette Printed Saree With Blouse,Sarees,299Rs,3.9, ANAND SAREES
Fab Brand Nevyblue Woven Design Art Silk Saree,Sarees,899Rs,4.5,FAB BRAND
Indian Beauty Women's White Georgette Printed Saree With Blouse Piece,Sarees,349Rs,3.3,INDIAN BEAUTY.
Bhuwal Fashion Beige Lycra Saree,Sarees,699Rs,2.3,Bhuwal Fashion
Stylzone Red Faux Georgette Embroidered Saree,Sarees,569Rs,3.6,STYLZONE
Stylezone Grey Chiffon Self Design  Saree With Blouse,Sarees,399Rs,3.5,STYLZONE
Ruchika Fashion  Woven Kanjivaram Multicolor Silk Saree  (Multicolor),Sarees,449Rs,3,Ruchika Fashions
Pemal Designer Of-White Paper silk saree With Jequart Blouse Pic BBC122B,Sarees,679Rs,, Mahadev Enterprises
Swaron Navy Blue Art Silk Printed Saree,Sarees,299Rs,4,Swaron
Anand Sarees Floral Fashion Faux Georgette Saree,Sarees,289Rs,4, ANAND SAREES
Indian Beauty Women'sYellow Color Art Silk Printed Saree Border Tassels With Blouse Piece(DILWALE-YELLOW_Free Size),Sarees,429Rs,,INDIAN BEAUTY.
Riti Riwaz Dark Green Printed Mysore Silk With Tessals Saree With Blouse Piece,Sarees,419Rs,3.5,Keshvi Fashions
Indian Beauty Multicolor Cotton Art Silk Embellished Saree With Blouse,Sarees,399Rs,3.7,INDIAN BEAUTY.
Yuvanika Multicolor Art Silk Printed Saree With Blouse,Sarees,369Rs,3.6,Yuvanika sare
Meia Orange Silk Embroidered Saree With Blouse,Sarees,549Rs,3.8,NEW MARUTI ENTERPRISE
Fabwomen Multicolor Net Printed Saree With Blouse,Sarees,499Rs,4.5,Fabwomen
Meia Women's Silk Checkered Saree Combo Pack of 2 (Sana Chokda 2 Pink-Red),Sarees,499Rs,,Great Rate
Goegette heavy embrodiery cut work saree with matty gloden embrodery work blouse,Sarees,900Rs,,tewatia creation
Fab Woven Women's Ethnic Wear Kanjivaram Cotton Silk Dark Blue-Green Colour Saree.,Sarees,799Rs,2.9, FAB WOVEN
Indian Beauty Women's Beige Color Khadi Silk Printed Saree Border Tassels With Blouse Piece(MARATHI-DANDIYA-CHIKU_Free Size),Sarees,499Rs,,INDIAN BEAUTY.
Aaina Yellow Chiffon Embroidered Saree With Blouse,Sarees,999Rs,,florence clothing company
Ruchika Fashion Multicolored Silk  Embroidered Saree with Blouse,Sarees,719Rs,3.8,Ruchika Fashions
Pari Designer red color Ruffle Saree,Sarees,499Rs,3.2,Pari Designerr
Dhanu Fashion Bollywood Designer Green Color Printed Saree,Sarees,699Rs,4,DHANUFASHION
Meia Orange Bhagalpuri Cotton Silk Printed Saree With Blouse,Sarees,419Rs,3.6,NEW MARUTI ENTERPRISE
Indian Beauty Women's Cream Color Kalamkari Mysore Silk Printed Saree Border Tassels With Blouse Piece(WORLD-DN-110Free Size),Sarees,399Rs,2.5,INDIAN BEAUTY.
Anand Sarees Printed Fashion Faux Georgette Saree,Sarees,289Rs,2.7, ANAND SAREES
Indian Beauty Women's Cotton Linen Blend Saree With Unstiched Blouse Piece,Sarees,399Rs,3.8,INDIAN BEAUTY.
Fab Brand Maroon Woven Design Art Silk Saree,Sarees,799Rs,,FAB BRAND
Bhavna Creation's Red Silk Saree,Sarees,1139Rs,,Bhavna creation
combo includes 2 sarees red color paper silk and white color georgette embroidery work saree with blouse work,Sarees,1480Rs,,tewatia creation
Samarth Fab Green Color Silk Chain Stitch Embroidererd Casual Wear Wedding Wear Party Wear Festive Wear Regular Free Size Bollywood Designer Saree With Blouse Piece,Sarees,899Rs,,Samarth Fab
Meia Women's Silk Checkered Saree Combo Pack of 2 (Sana Chokda 2 Pink-Green),Sarees,499Rs,5,Great Rate
The Shopoholic Georgette Navy Blue Lace Work Saree For Women,Sarees,399Rs,,The Shopoholic
Anand Sarees Multicolor Georgette Printed Saree With Blouse,Sarees,289Rs,4.1, ANAND SAREES
Aika Women's Georgette Plain Ruffle Saree (Ruffel Gajri),Sarees,799Rs,,Aika Fashion
Sarees....(Zypara Women's Bhagalpuri silk Sarees)..,Sarees,50000Rs,,Ekart  Solutions
Swaron Beige Poly Silk Woven Patta Saree With Unstitched Blouse,Sarees,419Rs,4.2,Swaron
Indian Beauty Women's Ikkat Cotton Silk With Blouse With Tassel Sarees,Sarees,449Rs,4.1,INDIAN BEAUTY.
Pemal Designer Women's Cotton Silk Weaving Saree With Jecqured Border Running Blouse Pics BBC91A,Sarees,649Rs,4, Mahadev Enterprises
Indian Beauty Art Cotton Silk Multi Color Partywear With Blouse Saree,Sarees,399Rs,3.5,INDIAN BEAUTY.
Ruchika Fashion Women's Checkered Handloom Cotton Linen Blend Saree with Blouse Piece (pinkGreen),Sarees,199Rs,,Ruchika Fashions
MMW Women's Embroidered Saree with Blouse Piece(Free Size),Sarees,399Rs,,Market  Magic World
Meia Women's Silk Chax Designer Saree (SANA SAREE YELLOW),Sarees,429Rs,,Great Rate
Fab Brand Shibori Printed Japan Crepe Silk Sarees,Sarees,819Rs,2,FAB BRAND
Swaron Yellow Georgette Printed Saree with Unstitched Blouse,Sarees,289Rs,,Swaron
Manohari Designer Red Georgette Saree,Sarees,1269Rs,4.3,onlinefayda
Indian Beauty Women's Green Color Zoya Silk Plain Saree With Jacquard Blouse Piece(ZOYA GREEN_Free Size),Sarees,499Rs,,INDIAN BEAUTY.
Swaron Black and Off-white Georgette Check Printed Saree,Sarees,369Rs,4.3,Swaron
Anand Sarees Multicolor Georgette Printed Saree With Blouse,Sarees,299Rs,3.8, ANAND SAREES
Bhuwal fashion Cream & Red Silk Printed Saree With Blouse,Sarees,399Rs,3.9,Bhuwal Fashion
Anand Sarees Printed Fashion Faux Georgette Saree,Sarees,289Rs,2.8, ANAND SAREES
FAB BRAND Women's  Banarasi Saree with Blouse Piece,Sarees,999Rs,4.2,FAB BRAND
Designer Bahu Green Color Paper Silk Designer Saree,Sarees,999Rs,2.3,Designer Bahu
Indian Beauty Art Cotton Silk With Blouse Saree,Sarees,399Rs,4.2,INDIAN BEAUTY.
Anand Sarees Floral Fashion Faux Georgette Saree,Sarees,289Rs,2.7, ANAND SAREES
Meia Blue Bhagalpuri Silk Printed Saree With Blouse,Sarees,339Rs,2.9,NEW MARUTI ENTERPRISE
Blue Art Silk Block print Saree Without Blouse,Sarees,189Rs,3.2,SVB SAREES
Indian Style Sarees New Arrivals Women'sLatest Designer Green Color Georgette Printed Saree With Blouse Bollywood Design,Sarees,549Rs,,RAJESHWAR FASHION
Shree Rajlaxmi Gold  Blue Polycotton Dobby Saree With Blouse,Sarees,589Rs,,shree raj laxmi sarees
Anand Sarees Floral Fashion Faux Georgette Saree,Sarees,299Rs,4.1, ANAND SAREES
Indian Beauty Women's Pink Color Sana Silk With Tessal Plain Saree With Embellished Blouse Piece,Sarees,589Rs,3,INDIAN BEAUTY.
Sharda Creation Multicolour  Bhagalpuri silk saree  Combo saree,Sarees,599Rs,4.5,SHARDA  CREATION
Indian Beauty Women's Black Color Mysore Silk Printed Saree Border Tassels With Blouse Piece(SUNDARAM-BLACK_Free Size),Sarees,399Rs,4,INDIAN BEAUTY.
MMW Women's Grey (COLORS AVAILABLE) Georgette Frill Ruffle Saree With Unstitched Blouse Piece,Sarees,699Rs,3.4,Market  Magic World
Meia Women's Silk Checkered Saree (Sana Chokda Pink),Sarees,299Rs,5,Great Rate
Anand Sarees Printed Fashion Faux Georgette Saree,Sarees,289Rs,3.6, ANAND SAREES
Sharda Creation Multicolour  Bhagalpuri silk saree,Sarees,329Rs,2.5,SHARDA  CREATION
ColorBox Black Cotton Silk Plain Saree With Blouse,Sarees,259Rs,3.2,colorbox
SVB SAree Yellow  Colour Silk Saree With blouse Piece,Sarees,499Rs,1.8,SHARDA  CREATION
Indian Beauty Women's Linen Saree With Blouse Piece (All Colors),Sarees,429Rs,3.7,INDIAN BEAUTY.
Swaron Black and White Red Georgette Saree Combo of 2,Sarees,579Rs,4.2,Swaron
Meia Pink Cotton Silk Embellished Saree With Blouse,Sarees,399Rs,3.8,NEW MARUTI ENTERPRISE
Aika Women's Cotton Silk Woven Saree (AURA SAREE PEACH),Sarees,299Rs,,Aika Fashion
Indian Style Sarees New Arrivals Latest Women's Multicolor Soft Art Khadi Silk Kalamkari Print With Blouse Saree,Sarees,299Rs,3.3,RAJESHWAR FASHION
stripes poly cotton saree Blue,Sarees,269Rs,4.3,colorbox
Indian Fashionista Women's Orange Kalamkari Banarasi Silk Saree With Blouse,Sarees,419Rs,,Indian Fashionista
Anand Sarees Black Color Chiffon Solid Plain Saree With Lace Border And Unstitched  Red Color Jacquard Blouse Piece ( 14703 ),Sarees,699Rs,, ANAND SAREES
Panaah Orange And Pink Georgette And Net Embroidery Thread Work Saree With Blouse,Sarees,909Rs,,Panaah_Surat
sana silk machine stone work saree with bangalori stone work blouse,Sarees,900Rs,,tewatia creation
Indian Beauty Women's Yellow Color Crepe Silk Printed Saree With Blouse Piece(Aakruti-180_Free Size),Sarees,549Rs,,INDIAN BEAUTY.
"THIYA Yellow Crepe Silk Printed Saree With Blouse(7701C,Free Size)",Sarees,1089Rs,,C 2 C CREATION
MMW Women's Orange Tussar Silk Checked Saree with Embroidered Blouse,Sarees,449Rs,,Market  Magic World
Great Rate Women's Cotton Silk Woven Saree (Aura 01 Sky Blue-Blk),Sarees,299Rs,,Great Rate
Greenvilla Designs Orange And Blue Paper Silk Saree with Blouse,Sarees,888Rs,,GREEN GARDEN PHOTO ART
Meia Blue and Yellow Art Silk Printed Saree combo pack of 2,Sarees,719Rs,,Swaron
Goegette heavy embrodiery cut work saree with matty gloden embrodery work blouse,Sarees,900Rs,,tewatia creation
Indian Fashionista Women's Half Half Banarasi Jacquard Silk Saree,Sarees,799Rs,,Indian Fashionista
Samarth Fab Purple Color Georgette Printed Casual Wear Wedding Wear Party Wear Festive Wear Regular Free Size Bollywood Designer Saree With Blouse Piece,Sarees,549Rs,,Samarth Fab
NineSister Red Net Saree,Sarees,1999Rs,,Designer Bahu
Anand Sarees Purple Color Kanjivaram & Banarasi Jacquard Silk Saree With Unstitched Blouse Piece (1536_3),Sarees,999Rs,, ANAND SAREES
Ajira Black Colour Woven Work Art Silk Saree MAYURI TRINGAL JAAL BLACK,Sarees,679Rs,,shree sanskruti
sana silk machine stone work saree with bangalori stone work blouse,Sarees,900Rs,,tewatia creation
Designer Cream and peach Color Jarana silk Festive And Function Wear Saree For Women(Bridalnetpeach),Sarees,549Rs,,RISE ON FAB
Indian Beauty Women's Yellow Color Khadi Silk Printed Saree With Blouse,Sarees,499Rs,,INDIAN BEAUTY.
Swaron Maroon Colored Print Poly silk Saree with Unstitched Blouse,Sarees,299Rs,,Swaron
Meia Women's Cotton Silk Woven Combo of 2 Saree (Aura Saree 2 Pista-Red),Sarees,499Rs,,Great Rate
Swaron Multicolor Poly Silk Printed Saree with unsticthed Blouse,Sarees,349Rs,,Swaron
Swaron Off White Bhagalpuri Silk Printed Saree With Unstitched Blouse,Sarees,399Rs,,Swaron
Bhuwal Fashion Green Chiffon Embroidered Saree With Blouse,Sarees,749Rs,,Bhuwal Fashion
Great Rate Women's Cotton Silk Printed Saree (MASTANI WEAVING GREEN-NEW),Sarees,369Rs,4,Great Rate
Indian Beauty Women's Orange Color Sana Silk Saree With Tessals and Unstiched Blouse Piece,Sarees,879Rs,5,INDIAN BEAUTY.
Swaron Green Cotton Silk Zari Woven (Kota Doria) Saree with Unstitched Blouse,Sarees,399Rs,,Swaron
Indian Beauty Yellow Georgette Self Design Saree With Blouse,Sarees,1869Rs,,INDIAN BEAUTY.
printed border chanderi cotton saree with printed blouse piece,Sarees,449Rs,, Nidhi Creations
Samarth Fab Red Color Silk Festive Wear Party Wear Casual Wear Wedding Wear Mix  Match Lace Work Plain Printed Contrast Bordered Bollywood Style Free Size With Blouse Designer Saree,Sarees,999Rs,,Samarth Fab
Priyanka Trends Beige Net Embroidered Saree With Blouse Piece,Sarees,2555Rs,,PriyankaTrends
Swaron Yellow Georgette Printed Saree with Unstitched Blouse,Sarees,369Rs,,Swaron
Indian Beauty Women's Printed Mysore Art Silk Saree With Blouse,Sarees,439Rs,3,INDIAN BEAUTY.
Great Rate Women's Georgette Embroidery Work Saree (Mintrosi Saree Blue),Sarees,559Rs,,Great Rate
Swaron Orange and Multicolor Georgette Printed Saree Combo (Pack of 2),Sarees,599Rs,,Swaron
Indian Style Sarees New Arrivals Latest Women's Multi Color Chanderi Cotton With Blouse Sarees Bollywood Designer Saree,Sarees,579Rs,4.2,RAJESHWAR FASHION
Meia Pink Bhagalpuri Silk Graphic Print Saree With Blouse,Sarees,449Rs,3.5,Swaron
Meia White Georgette Plain Saree With Blouse,Sarees,659Rs,2.3,Pari Designerr
Anand Sarees Multicolor Faux Georgette Printed Saree With Blouse ( Pack of 4 sarees),Sarees,999Rs,, ANAND SAREES
Meia Pink Art Silk Printed Saree With Blouse,Sarees,299Rs,5,Swaron
bhavna creation's brand new collection pink designer sarees with blouse piece,Sarees,629Rs,1,Bhavna creation
Indian Beauty Black Cotton Plain Saree With Blouse,Sarees,379Rs,1,INDIAN BEAUTY.
Aika Women's Cotton Silk Striped Saree (Kimora Mehendi),Sarees,329Rs,,Aika Fashion
Navy blue georgette saree with brocade blouse piece,Sarees,709Rs,,Bhavna creation
Womens Fashion Chiffon Saree,Sarees,529Rs,4.5,STYLZONE
Fabwomen Sarees Zari Work Multicolor And Beige  Coloured Kanjivaram Silk Traditional Party Wear Women's Saree/Sari With Blouse Piece.,Sarees,399Rs,,Fabwomen
Meia Black and red Chiffon Embroidered Saree With Blouse,Sarees,559Rs,,florence clothing company
Samarth Fab Pink Color Chiffon Chain Stitch Embroidererd Casual Wear Wedding Wear Party Wear Festive Wear Regular Free Size Bollywood Designer Saree With Blouse Piece,Sarees,1049Rs,,Samarth Fab
Oxza Women's Pink Color Sana Silk Saree With Unstiched Blouse Piece (s-129),Sarees,1299Rs,,JACK AND JILL LOGISTICS
Fab Brand Multicolor Kanjivaram Tussar Silk Saree,Sarees,749Rs,3.8,FAB BRAND
Indian Beauty Women's Pink Color Satin Silk Jhumuki Lace Border Saree With Blouse Piece(PAPER JHUMKI PINK _Free Size),Sarees,699Rs,,INDIAN BEAUTY.
SVB Saree Red Black  Litchi silk saree with blouse piece,Sarees,469Rs,,SVB SAREES
Women's Navy Blue Georgette Ruffle Saree With Blouse,Sarees,999Rs,3.4,Vaishnavi Art
Tamtam Silk Saree Red,Sarees,379Rs,,colorbox
Indian Beauty Women's Orange Color Sana Silk With Tessal Plain Saree With Embellished Blouse Piece,Sarees,549Rs,,INDIAN BEAUTY.
Swaron Black and Navy Red Georgette Saree Combo of 2,Sarees,569Rs,,Swaron
WHITE WORLD CREATION WOMEN'S NET AND VELVET HOTTED RED AND WHITE COLOR SAREE,Sarees,479Rs,,White world creation
new Gold & Black Cotton Self Design Saree With Blouse,Sarees,379Rs,4.2,RAJESHWAR FASHION
Aika Women's Cotton Silk Striped Saree (Rustam Maroon),Sarees,349Rs,,Aika Fashion
Priyansh CreationSelf Design Fashion Pure Cotton Saree,Sarees,499Rs,,PRIYANSHCREATION
Sharda Creation Multicolour  Bhagalpuri silk saree  Combo saree,Sarees,919Rs,,SVB SAREES
Indian Fashionista Women's Turquoise Embellished Banarasi Silk Saree With Blouse,Sarees,779Rs,5,Indian Fashionista
Srk Green Color Georgette Plain Saree sn80c,Sarees,979Rs,2.1,Shree Ram Krishna Enterprise
Indian Beauty Women's Beige&Lime&Sky Black Art Cotton Blended Saree With Blouse Pack of 3,Sarees,899Rs,,INDIAN BEAUTY.
Meia Yellow Bhagalpuri Silk Block Print Saree With Blouse,Sarees,349Rs,2.6,SVB SAREES
Pemal Designer Chanderi Cotton Saree With Jacquard Blouse Pic BBC124F,Sarees,549Rs,, Mahadev Enterprises
Samarth Fab Blue Color Georgette Stone Work + Hand Print Casual Wear Wedding Wear Party Wear Festive Wear Regular Free Size Bollywood Designer Saree With Blouse Piece,Sarees,879Rs,,Samarth Fab
Bigben Textile Women's Red Georgette Ruffle Saree With Blouse,Sarees,799Rs,,Vaishnavi Art
Net saree with heavy embroidery thread work,Sarees,1545Rs,,FashionMoonflower
"Swaron Yellow Chiffon Printed, Border Saree with unsticthed Blouse",Sarees,499Rs,,Swaron
Pemal Designers Cotton Silk Saree With Blouse Pic BBC129I,Sarees,999Rs,5, Mahadev Enterprises
Meia Red Polyester Printed Saree With Blouse,Sarees,289Rs,3,Swaron
Pemal Designer Pink Cotton Banarasi Silk Saree With Running Blouse Pics RJM1129D,Sarees,849Rs,1, Mahadev Enterprises
Indian Beauty Women's Sky Blue Color Cotton Silk Blend Linening Saree Border Tassels With Blouse Piece(LINEN-S182621-SKY BLUE_Free Size),Sarees,389Rs,,INDIAN BEAUTY.
Florence Navy Blue Georgette Plain Saree,Sarees,499Rs,,florence clothing company
Indian Beauty Art Cotton Silk Partywear With Blouse Saree,Sarees,449Rs,,INDIAN BEAUTY.
Meia Grey Art Silk Plain Saree With Blouse,Sarees,319Rs,2.5,Swaron
Sharda Creation Multicolour  Bhagalpuri silk saree  Combo saree,Sarees,899Rs,,SVB SAREES
Beautiful Kanjivaram Silk Saree,Sarees,1039Rs,2,FAB BRAND
Anand Sarees Blue Color Faux Georgette Saree With Unstitched Blue Color Blouse Piece ( 1475 ),Sarees,399Rs,, ANAND SAREES
Meia Women's Satin Embroidery Saree (S025-Booti-Pink),Sarees,799Rs,,Great Rate
Anand Sarees Floral Fashion Faux Georgette Saree,Sarees,339Rs,, ANAND SAREES
Indian Style Sarees New Arrivals Latest Women's Green Color Chanderi Cotton Kalamkari Print Border With Kalamkari Blouse,Sarees,379Rs,5,RAJESHWAR FASHION
Srk White and Skyblue Colour Nylone Net Embroidered Saree,Sarees,1799Rs,2.7,Shree Ram Krishna Enterprise
Meia Red Chiffon Embroidered Saree With Blouse,Sarees,1089Rs,4.3,Bhuwal Fashion
Pemal Designer Women's Banarasi Silk Weaving Saree With Jecqured Border Running Blouse Pics BBC115EE,Sarees,999Rs,, Mahadev Enterprises
Anand Sarees Multicoloured Georgette Saree with Blouse Piece ( 14461 ),Sarees,289Rs,5, ANAND SAREES
Anand Sarees Green Color Chiffon Solid Plain Saree With Lace Border And Unstitched  Black Color Jacquard Blouse Piece ( 1486_2 ),Sarees,449Rs,, ANAND SAREES
Stylezone Zarana Silk Embroidered Saree With Blouse-BF5061green,Sarees,399Rs,,STYLZONE
BUY CREAM WHITE GEORGETTE SAREE WITH 3D ROSE WORK AT INDIAN VELVET,Sarees,1799Rs,5,nafashion
Stylezone Designer Blue Chiffon Saree,Sarees,499Rs,,STYLZONE
Panaah Red Cotton Silk Weaved Saree With Blouse,Sarees,349Rs,3.4,Panaah_Surat
Indian Beauty Multicolor Georgette Self Design Saree With Blouse,Sarees,379Rs,,RAJESHWAR FASHION
"Swaron Yellow Chiffon Bandhani Print, Border Saree with unsticthed Blouse",Sarees,499Rs,,Swaron
Indian Style Sarees New Arrivals Latest Sarees for Women's Prachi Desai Bollywood Embroidered Silk Saree With Blouse Sar,Sarees,1069Rs,4.7,RAJESHWAR FASHION
Indian Beauty Women's Blue Color Mysore Art Silk Printed Saree Border Tassels With Blouse Piece(HIPHOP BLUE REDFree Size),Sarees,399Rs,,INDIAN BEAUTY.
Pradeep Fashion Exclusive Cotton printed Blue  Musturd Color WIthout Blouse Sarees,Sarees,289Rs,,  PRADEEP FASHION
Meia Maroon Georgette Embroidered Saree With Blouse,Sarees,1329Rs,4.5,onlinefayda
Fab Woven Kanjivaram Raw Silk Saree,Sarees,749Rs,3.5, FAB WOVEN
Indian Style Sarees New Arrivals Latest Women's Bollywood Designer Multicolor Georgette Printed Saree With Blouse,Sarees,549Rs,,RAJESHWAR FASHION
SVB SAREES Blue  Art Silk  Block Print Saree Without Blouse,Sarees,249Rs,2.5,SVB SAREES
Bhavna creation Black Georgette Embroidered Saree With Blouse,Sarees,999Rs,,Bhavna creation
Women's White Color Kanjivaram Silk Jecqured Border Saree With Blouse Piece,Sarees,799Rs,,INDIAN BEAUTY.
Indian Beauty Women's Grey Color Bhagalpuri Silk Printed Saree With Blouse,Sarees,419Rs,3.3,INDIAN BEAUTY.
Indian Style Sarees New Arrivals Latest Women's Multi Color Chanderi Cotton Printed Border Work Bollywood Designer Saree,Sarees,389Rs,,RAJESHWAR FASHION
Meia Women's Cotton Silk Woven Saree (Kajal Blue),Sarees,299Rs,,Great Rate
Bhavna Creation's Coffee Silk Saree,Sarees,1119Rs,,Bhavna creation
Indian Fashionista Women's Turquoise Embellished Banarasi Silk Saree With Blouse,Sarees,779Rs,,Indian Fashionista
Srk White and Skyblue Colour net Embroidered Saree KT-3197,Sarees,1819Rs,1,Shree Ram Krishna Enterprise
Bollywood Style Embroidered Zarana Silk Saree with Contrast Blouse,Sarees,439Rs,3.8,Bhuwal Fashion
Meia Multicolor Cotton Block Print With Blouse Saree,Sarees,399Rs,,FANCYWEAR
Indian Beauty Peach Silk Printed Saree With Blouse,Sarees,399Rs,2.5,INDIAN BEAUTY.
Anand Sarees Faux Georgette Brown Colored printed Sarees With Blouse Piece( 1052_2 ),Sarees,299Rs,2.3, ANAND SAREES
Fabwomen Sarees Kalamkari Black And Multi  Coloured Mysore Art Silk With Tassels Fashion Party Wear Women's Saree/Sari.,Sarees,399Rs,3.8,Fabwomen
Indian Beauty Women's Pink Color Chanderi Printed  With Blouse Sarees,Sarees,449Rs,3.3,INDIAN BEAUTY.
orange sana silk saree with blouse piece,Sarees,649Rs,, Nidhi Creations
Pari Designerr Yellow Color Georgette Embroidered Saree With Blouse,Sarees,649Rs,4.1,Pari Designerr
Bhuwal Fashion Blue Chiffon Lace Saree With Blouse,Sarees,629Rs,4.7,Bhuwal Fashion
Women's Yellow Color Kalamkari Silk Printed Saree Border Tassels With Blouse Piece (KATHAK YELLOWFree Size),Sarees,399Rs,5,INDIAN BEAUTY.
Fab Woven Kanjivaram Tussar Silk Saree,Sarees,749Rs,4.1, FAB WOVEN
FAB BRAND Women's Kanjivaram Raw Silk With Jecqured Border With Blouse Saree,Sarees,729Rs,3.8,FAB BRAND
Indian Beauty Women's Mysore Silk With Blouse Saree With Unstitched Blouse Piece,Sarees,459Rs,3.5,INDIAN BEAUTY.
Ruchika Fashion Latest Designer Saree Print Collection For Women with Heavy Embroidery Blouse Piece ( Jyoti ),Sarees,810Rs,3,Ruchika Fashions
Aruna Sarees Women's Pink Embellished Net Saree With Blouse,Sarees,999Rs,4.8,Aruna Sarees
Mastani Sarees New Arrivals Latest Women's  Cream Zarna Silk Butterfly Embroidered Bollywood Designer,Sarees,599Rs,4,NEW MARUTI ENTERPRISE
Meia Women's Cotton Silk Striped Saree (Deepika Red),Sarees,349Rs,,Great Rate
MMW Women's Black Georgette Ruffle Saree With Blouse Piece (Free Size),Sarees,699Rs,5,Market  Magic World
Anand Sarees Printed Fashion Faux Georgette Saree,Sarees,289Rs,1.5, ANAND SAREES
Swaron Red Georgette Bandhani Print Saree With Unstitched Blouse,Sarees,369Rs,2.7,Swaron
Sharda Creation Multicolour  Khadi silk With foil  Combo saree,Sarees,999Rs,3,SHARDA  CREATION
Fabwomen Turquoise Art Silk Printed Saree With Blouse,Sarees,399Rs,3.2,Fabwomen
Net Printed Saree,Sarees,2199Rs,4.7,nafashion
WHITE WORLD CREATION Girl's Net And Velvet RED And CHIKU Color SAREE,Sarees,489Rs,,White world creation
"FAB BRAND Women's Kanjivaram Art Silk Saree, Free Size",Sarees,889Rs,,FAB BRAND
Fab Brand Multicolor Kanjivaram Raw Silk Saree,Sarees,739Rs,3.4,FAB BRAND
Anand Sarees Printed Fashion Faux Georgette Saree,Sarees,289Rs,, ANAND SAREES
Bhuwal Fashion Red Lycra Saree,Sarees,719Rs,3.5,Bhuwal Fashion
Pemal Designer Women's Cotton Silk Weaving Saree With Jecqured Border Running Blouse Pics BBC93A,Sarees,649Rs,2.5, Mahadev Enterprises
Meia Women's Cotton Silk Plain Saree (AANGI BLACK),Sarees,299Rs,1,Great Rate
